{
  "$schema": "./schemas/profile.schema.json",
  "schema_version": 1,
  "robot": "DeepRobotics DR02 Pro",
  "joint_order": [
    "waist_z_joint",
    "waist_x_joint",
    "waist_y_joint",
    "left_shoulder_y_joint",
    "left_shoulder_x_joint",
    "left_shoulder_z_joint",
    "left_elbow_joint",
    "left_wrist_z_joint",
    "left_wrist_y_joint",
    "left_wrist_x_joint",
    "right_shoulder_y_joint",
    "right_shoulder_x_joint",
    "right_shoulder_z_joint",
    "right_elbow_joint",
    "right_wrist_z_joint",
    "right_wrist_y_joint",
    "right_wrist_x_joint",
    "left_hip_y_joint",
    "left_hip_x_joint",
    "left_hip_z_joint",
    "left_knee_joint",
    "left_ankle_y_joint",
    "left_ankle_x_joint",
    "right_hip_y_joint",
    "right_hip_x_joint",
    "right_hip_z_joint",
    "right_knee_joint",
    "right_ankle_y_joint",
    "right_ankle_x_joint"
  ],
  "joint_groups": {
    "waist": [
      "waist_z_joint",
      "waist_x_joint",
      "waist_y_joint"
    ],
    "arms": [
      "left_shoulder_y_joint",
      "left_shoulder_x_joint",
      "left_shoulder_z_joint",
      "left_elbow_joint",
      "left_wrist_z_joint",
      "left_wrist_y_joint",
      "left_wrist_x_joint",
      "right_shoulder_y_joint",
      "right_shoulder_x_joint",
      "right_shoulder_z_joint",
      "right_elbow_joint",
      "right_wrist_z_joint",
      "right_wrist_y_joint",
      "right_wrist_x_joint"
    ],
    "left_leg": [
      "left_hip_y_joint",
      "left_hip_x_joint",
      "left_hip_z_joint",
      "left_knee_joint",
      "left_ankle_y_joint",
      "left_ankle_x_joint"
    ],
    "right_leg": [
      "right_hip_y_joint",
      "right_hip_x_joint",
      "right_hip_z_joint",
      "right_knee_joint",
      "right_ankle_y_joint",
      "right_ankle_x_joint"
    ]
  },
  "joint_orders": {
    "canonical": [
      "waist_z_joint",
      "waist_x_joint",
      "waist_y_joint",
      "left_shoulder_y_joint",
      "left_shoulder_x_joint",
      "left_shoulder_z_joint",
      "left_elbow_joint",
      "left_wrist_z_joint",
      "left_wrist_y_joint",
      "left_wrist_x_joint",
      "right_shoulder_y_joint",
      "right_shoulder_x_joint",
      "right_shoulder_z_joint",
      "right_elbow_joint",
      "right_wrist_z_joint",
      "right_wrist_y_joint",
      "right_wrist_x_joint",
      "left_hip_y_joint",
      "left_hip_x_joint",
      "left_hip_z_joint",
      "left_knee_joint",
      "left_ankle_y_joint",
      "left_ankle_x_joint",
      "right_hip_y_joint",
      "right_hip_x_joint",
      "right_hip_z_joint",
      "right_knee_joint",
      "right_ankle_y_joint",
      "right_ankle_x_joint"
    ],
    "amp_motion": [
      "waist_z_joint",
      "waist_x_joint",
      "waist_y_joint",
      "left_shoulder_y_joint",
      "left_shoulder_x_joint",
      "left_shoulder_z_joint",
      "left_elbow_joint",
      "left_wrist_z_joint",
      "left_wrist_y_joint",
      "left_wrist_x_joint",
      "right_shoulder_y_joint",
      "right_shoulder_x_joint",
      "right_shoulder_z_joint",
      "right_elbow_joint",
      "right_wrist_z_joint",
      "right_wrist_y_joint",
      "right_wrist_x_joint",
      "left_hip_y_joint",
      "left_hip_x_joint",
      "left_hip_z_joint",
      "left_knee_joint",
      "left_ankle_y_joint",
      "left_ankle_x_joint",
      "right_hip_y_joint",
      "right_hip_x_joint",
      "right_hip_z_joint",
      "right_knee_joint",
      "right_ankle_y_joint",
      "right_ankle_x_joint"
    ],
    "tracking": [
      "waist_z_joint",
      "waist_x_joint",
      "waist_y_joint",
      "left_shoulder_y_joint",
      "left_shoulder_x_joint",
      "left_shoulder_z_joint",
      "left_elbow_joint",
      "left_wrist_z_joint",
      "left_wrist_y_joint",
      "left_wrist_x_joint",
      "right_shoulder_y_joint",
      "right_shoulder_x_joint",
      "right_shoulder_z_joint",
      "right_elbow_joint",
      "right_wrist_z_joint",
      "right_wrist_y_joint",
      "right_wrist_x_joint",
      "left_hip_y_joint",
      "left_hip_x_joint",
      "left_hip_z_joint",
      "left_knee_joint",
      "left_ankle_y_joint",
      "left_ankle_x_joint",
      "right_hip_y_joint",
      "right_hip_x_joint",
      "right_hip_z_joint",
      "right_knee_joint",
      "right_ankle_y_joint",
      "right_ankle_x_joint"
    ]
  },
  "joints": {
    "waist_z_joint": {
      "type": "revolute",
      "parent_body": "base_link",
      "child_body": "waist_z_link",
      "axis_xyz": [
        0.0,
        0.0,
        1.0
      ],
      "limits": {
        "position_rad": [
          -1.7453,
          3.6652
        ],
        "velocity_rad_s": 19.38,
        "effort_nm": 137.0
      },
      "default_position_rad": 0.0
    },
    "waist_x_joint": {
      "type": "revolute",
      "parent_body": "waist_z_link",
      "child_body": "waist_x_link",
      "axis_xyz": [
        1.0,
        0.0,
        0.0
      ],
      "limits": {
        "position_rad": [
          -0.6981,
          0.6981
        ],
        "velocity_rad_s": 19.38,
        "effort_nm": 137.0
      },
      "default_position_rad": 0.0
    },
    "waist_y_joint": {
      "type": "revolute",
      "parent_body": "waist_x_link",
      "child_body": "body",
      "axis_xyz": [
        0.0,
        1.0,
        0.0
      ],
      "limits": {
        "position_rad": [
          -0.5236,
          1.5708
        ],
        "velocity_rad_s": 20.0,
        "effort_nm": 363.0
      },
      "default_position_rad": 0.0
    },
    "left_shoulder_y_joint": {
      "type": "revolute",
      "parent_body": "body",
      "child_body": "left_shoulder_y_link",
      "axis_xyz": [
        0.0,
        1.0,
        0.0
      ],
      "limits": {
        "position_rad": [
          -3.8397,
          1.5708
        ],
        "velocity_rad_s": 19.38,
        "effort_nm": 137.0
      },
      "default_position_rad": 0.0
    },
    "left_shoulder_x_joint": {
      "type": "revolute",
      "parent_body": "left_shoulder_y_link",
      "child_body": "left_shoulder_x_link",
      "axis_xyz": [
        1.0,
        0.0,
        0.0
      ],
      "limits": {
        "position_rad": [
          -0.349066,
          3.49066
        ],
        "velocity_rad_s": 19.38,
        "effort_nm": 137.0
      },
      "default_position_rad": 0.0
    },
    "left_shoulder_z_joint": {
      "type": "revolute",
      "parent_body": "left_shoulder_x_link",
      "child_body": "left_shoulder_z_link",
      "axis_xyz": [
        0.0,
        0.0,
        1.0
      ],
      "limits": {
        "position_rad": [
          -2.9671,
          2.9671
        ],
        "velocity_rad_s": 19.38,
        "effort_nm": 137.0
      },
      "default_position_rad": 0.765
    },
    "left_elbow_joint": {
      "type": "revolute",
      "parent_body": "left_shoulder_z_link",
      "child_body": "left_elbow_link",
      "axis_xyz": [
        0.0,
        1.0,
        0.0
      ],
      "limits": {
        "position_rad": [
          -0.767945,
          1.74533
        ],
        "velocity_rad_s": 19.38,
        "effort_nm": 137.0
      },
      "default_position_rad": 1.25
    },
    "left_wrist_z_joint": {
      "type": "revolute",
      "parent_body": "left_elbow_link",
      "child_body": "left_wrist_z_link",
      "axis_xyz": [
        0.0,
        0.0,
        1.0
      ],
      "limits": {
        "position_rad": [
          -2.9671,
          2.9671
        ],
        "velocity_rad_s": 23.76,
        "effort_nm": 50.0
      },
      "default_position_rad": 0.0
    },
    "left_wrist_y_joint": {
      "type": "revolute",
      "parent_body": "left_wrist_z_link",
      "child_body": "left_wrist_y_link",
      "axis_xyz": [
        0.0,
        1.0,
        0.0
      ],
      "limits": {
        "position_rad": [
          -1.5708,
          1.5708
        ],
        "velocity_rad_s": 23.76,
        "effort_nm": 50.0
      },
      "default_position_rad": 0.0
    },
    "left_wrist_x_joint": {
      "type": "revolute",
      "parent_body": "left_wrist_y_link",
      "child_body": "left_wrist_x_link",
      "axis_xyz": [
        1.0,
        0.0,
        0.0
      ],
      "limits": {
        "position_rad": [
          -1.5708,
          1.5708
        ],
        "velocity_rad_s": 23.76,
        "effort_nm": 50.0
      },
      "default_position_rad": 0.0
    },
    "left_hand_joint": {
      "type": "fixed",
      "parent_body": "left_wrist_x_link",
      "child_body": "left_hand_link",
      "axis_xyz": [
        0.0,
        0.0,
        0.0
      ]
    },
    "right_shoulder_y_joint": {
      "type": "revolute",
      "parent_body": "body",
      "child_body": "right_shoulder_y_link",
      "axis_xyz": [
        0.0,
        1.0,
        0.0
      ],
      "limits": {
        "position_rad": [
          -3.8397,
          1.5708
        ],
        "velocity_rad_s": 19.38,
        "effort_nm": 137.0
      },
      "default_position_rad": 0.0
    },
    "right_shoulder_x_joint": {
      "type": "revolute",
      "parent_body": "right_shoulder_y_link",
      "child_body": "right_shoulder_x_link",
      "axis_xyz": [
        1.0,
        0.0,
        0.0
      ],
      "limits": {
        "position_rad": [
          -3.49066,
          0.349066
        ],
        "velocity_rad_s": 19.38,
        "effort_nm": 137.0
      },
      "default_position_rad": 0.0
    },
    "right_shoulder_z_joint": {
      "type": "revolute",
      "parent_body": "right_shoulder_x_link",
      "child_body": "right_shoulder_z_link",
      "axis_xyz": [
        0.0,
        0.0,
        1.0
      ],
      "limits": {
        "position_rad": [
          -2.9671,
          2.9671
        ],
        "velocity_rad_s": 19.38,
        "effort_nm": 137.0
      },
      "default_position_rad": -0.765
    },
    "right_elbow_joint": {
      "type": "revolute",
      "parent_body": "right_shoulder_z_link",
      "child_body": "right_elbow_link",
      "axis_xyz": [
        0.0,
        1.0,
        0.0
      ],